{
  "characters": [
    {
      "role": "Protagonist",
      "name": "Casey Chen",
      "goal": "expose time-repo agents collect the final payment",
      "ambition": "justice",
      "values": [
        "Nothing is more important than protecting the innocent.",
        "Nothing is more important than telling the truth.",
        "Nothing is more important than keeping my word."
      ],
      "conflict": "time-repo agents collect the final payment blocks Casey Chen by controlling key evidence and allies.",
      "epiphany": "Realizes that working strictly by the book empowers corruption and learns to act with courageous flexibility.",
      "one_sentence_summary": "Casey Chen, a desperate college graduate, must expose time-repo agents collect the final payment despite time-repo agents collect the final payment.",
      "one_paragraph_summary": "Beginning: Casey Chen commits to expose time-repo agents collect the final payment (D1). Middle: after a devastating reversal, Casey Chen realizes the old belief was false and must change tactics (D2). End: pressure narrows to one path and forces the final confrontation (D3)."
    },
    {
      "role": "Antagonist",
      "name": "Morrison",
      "goal": "protect the operation and stop the investigation",
      "ambition": "power",
      "values": [
        "Nothing is more important than maintaining control.",
        "Nothing is more important than security.",
        "Nothing is more important than my family's future."
      ],
      "conflict": "Opposes Casey Chen by withholding resources and deploying corrupt leverage to stop the goal.",
      "epiphany": "NONE",
      "epiphany_justification": "Believes the ends justify the means; admits no change because control is the only way to survive.",
      "one_sentence_summary": "A powerful rival blocks the investigation to keep his empire intact.",
      "one_paragraph_summary": "Act I: sets traps that commit the hero (D1). Act II: escalates pressure and reveals the hero's false belief (D2). Act III: forces a single endgame that creates the showdown (D3).",
      "interiority": {
        "motive_history": "Early failures and threats to his family taught him that control protects those he loves.",
        "justification": "He frames corruption as necessary to provide security and stability."
      }
    }
  ],
  "character_count": 2,
  "metadata": {
    "project_id": "the_immortality_tax_20250820_000356",
    "step": 3,
    "version": "1.0.0",
    "created_at": "2025-08-20T00:05:26.209109",
    "model_name": "claude-3-haiku-20240307",
    "temperature": 0.3,
    "seed": 42,
    "prompt_hash": "71957e3e9324746020193c65f39026242a47767740f39cc75893fcce97fa34ac",
    "validator_version": "1.0.0",
    "hash_upstream": "51fbab43dcdc07d19f58518eb3c1bf78dee4173b74ed4b2489fc09041341ce8d"
  },
  "protagonist_antagonist_collision": {
    "collision_verified": true,
    "collision_point": "Direct opposition of goals"
  },
  "disaster_alignment": {
    "d1_characters": [
      "Casey Chen",
      "Morrison"
    ],
    "d2_characters": [
      "Casey Chen",
      "Morrison"
    ],
    "d3_characters": [
      "Casey Chen",
      "Morrison"
    ]
  }
}