{
  "characters": [
    {
      "role": "Protagonist",
      "name": "Emily",
      "goal": "expose a deadly conspiracy",
      "ambition": "justice",
      "values": [
        "Nothing is more important than protecting the innocent.",
        "Nothing is more important than telling the truth.",
        "Nothing is more important than keeping my word."
      ],
      "conflict": "being targeted by her CEO and a mysterious government agent blocks Emily by controlling key evidence and allies.",
      "epiphany": "Realizes that working strictly by the book empowers corruption and learns to act with courageous flexibility.",
      "one_sentence_summary": "Emily, a cybersecurity expert, must expose a deadly conspiracy despite being targeted by her CEO and a mysterious government agent.",
      "one_paragraph_summary": "Beginning: Emily commits to expose a deadly conspiracy (D1). Middle: after a devastating reversal, Emily realizes the old belief was false and must change tactics (D2). End: pressure narrows to one path and forces the final confrontation (D3)."
    },
    {
      "role": "Antagonist",
      "name": "Morrison",
      "goal": "protect the operation and stop the investigation",
      "ambition": "power",
      "values": [
        "Nothing is more important than maintaining control.",
        "Nothing is more important than security.",
        "Nothing is more important than my family's future."
      ],
      "conflict": "Opposes Emily by withholding resources and deploying corrupt leverage to stop the goal.",
      "epiphany": "NONE",
      "epiphany_justification": "Believes the ends justify the means; admits no change because control is the only way to survive.",
      "one_sentence_summary": "A powerful rival blocks the investigation to keep his empire intact.",
      "one_paragraph_summary": "Act I: sets traps that commit the hero (D1). Act II: escalates pressure and reveals the hero's false belief (D2). Act III: forces a single endgame that creates the showdown (D3).",
      "interiority": {
        "motive_history": "Early failures and threats to his family taught him that control protects those he loves.",
        "justification": "He frames corruption as necessary to provide security and stability."
      }
    }
  ],
  "character_count": 2,
  "metadata": {
    "project_id": "code_of_deception_20250821_212841",
    "step": 3,
    "version": "1.0.0",
    "created_at": "2025-08-21T21:32:56.670360",
    "model_name": "claude-3-haiku-20240307",
    "temperature": 0.3,
    "seed": 42,
    "prompt_hash": "27baa3a916f048315c69ae8c650acca21ca93b90b8ec45859a4d7abaa9ce84df",
    "validator_version": "1.0.0",
    "hash_upstream": "36d2fce270097e2bf18cac740a6c0a55675c09d12f43e581f49ed4dc93c257d6"
  },
  "protagonist_antagonist_collision": {
    "collision_verified": true,
    "collision_point": "Direct opposition of goals"
  },
  "disaster_alignment": {
    "d1_characters": [
      "Emily",
      "Morrison"
    ],
    "d2_characters": [
      "Emily",
      "Morrison"
    ],
    "d3_characters": [
      "Emily",
      "Morrison"
    ]
  }
}