{
  "characters": [
    {
      "role": "Protagonist",
      "name": "Mara",
      "goal": "steal the banned-history archive",
      "ambition": "justice",
      "values": [
        "Nothing is more important than protecting the innocent.",
        "Nothing is more important than telling the truth.",
        "Nothing is more important than keeping my word."
      ],
      "conflict": "the regime's surveillance dragnet and a double agent inside her unit blocks Mara by controlling key evidence and allies.",
      "epiphany": "Realizes that working strictly by the book empowers corruption and learns to act with courageous flexibility.",
      "one_sentence_summary": "Mara, a internal-affairs records auditor, must steal the banned-history archive despite the regime's surveillance dragnet and a double agent inside her unit.",
      "one_paragraph_summary": "Beginning: Mara commits to steal the banned-history archive (D1). Middle: after a devastating reversal, Mara realizes the old belief was false and must change tactics (D2). End: pressure narrows to one path and forces the final confrontation (D3)."
    },
    {
      "role": "Antagonist",
      "name": "Morrison",
      "goal": "protect the operation and stop the investigation",
      "ambition": "power",
      "values": [
        "Nothing is more important than maintaining control.",
        "Nothing is more important than security.",
        "Nothing is more important than my family's future."
      ],
      "conflict": "Opposes Mara by withholding resources and deploying corrupt leverage to stop the goal.",
      "epiphany": "NONE",
      "epiphany_justification": "Believes the ends justify the means; admits no change because control is the only way to survive.",
      "one_sentence_summary": "A powerful rival blocks the investigation to keep his empire intact.",
      "one_paragraph_summary": "Act I: sets traps that commit the hero (D1). Act II: escalates pressure and reveals the hero's false belief (D2). Act III: forces a single endgame that creates the showdown (D3).",
      "interiority": {
        "motive_history": "Early failures and threats to his family taught him that control protects those he loves.",
        "justification": "He frames corruption as necessary to provide security and stability."
      }
    }
  ],
  "character_count": 2,
  "metadata": {
    "project_id": "full_e2e_test_novel_20250821_110957",
    "step": 3,
    "version": "1.0.0",
    "created_at": "2025-08-21T11:55:05.978843",
    "model_name": "claude-3-haiku-20240307",
    "temperature": 0.3,
    "seed": 42,
    "prompt_hash": "9e9b42c6a4c253c59bcd487c434d6ac35d7b2b63034b61d4e7e1407874b64bf7",
    "validator_version": "1.0.0",
    "hash_upstream": "9cfd0b6fd8f89ad83c9a59f52eff596a2e6cd50028f552c9243cd75ab0bbcc60"
  },
  "protagonist_antagonist_collision": {
    "collision_verified": true,
    "collision_point": "Direct opposition of goals"
  },
  "disaster_alignment": {
    "d1_characters": [
      "Mara",
      "Morrison"
    ],
    "d2_characters": [
      "Mara",
      "Morrison"
    ],
    "d3_characters": [
      "Mara",
      "Morrison"
    ]
  }
}