{
  "characters": [
    {
      "role": "Protagonist",
      "name": "Maya",
      "goal": "expose the officers who staged a shooting",
      "ambition": "justice",
      "values": [
        "Nothing is more important than protecting the innocent.",
        "Nothing is more important than telling the truth.",
        "Nothing is more important than keeping my word."
      ],
      "conflict": "the police union and command staff stonewalling her case blocks Maya by controlling key evidence and allies.",
      "epiphany": "Realizes that working strictly by the book empowers corruption and learns to act with courageous flexibility.",
      "one_sentence_summary": "Maya, a internal-affairs detective, must expose the officers who staged a shooting despite the police union and command staff stonewalling her case.",
      "one_paragraph_summary": "Beginning: Maya commits to expose the officers who staged a shooting (D1). Middle: after a devastating reversal, Maya realizes the old belief was false and must change tactics (D2). End: pressure narrows to one path and forces the final confrontation (D3)."
    },
    {
      "role": "Antagonist",
      "name": "Morrison",
      "goal": "protect the operation and stop the investigation",
      "ambition": "power",
      "values": [
        "Nothing is more important than maintaining control.",
        "Nothing is more important than security.",
        "Nothing is more important than my family's future."
      ],
      "conflict": "Opposes Maya by withholding resources and deploying corrupt leverage to stop the goal.",
      "epiphany": "NONE",
      "epiphany_justification": "Believes the ends justify the means; admits no change because control is the only way to survive.",
      "one_sentence_summary": "A powerful rival blocks the investigation to keep his empire intact.",
      "one_paragraph_summary": "Act I: sets traps that commit the hero (D1). Act II: escalates pressure and reveals the hero's false belief (D2). Act III: forces a single endgame that creates the showdown (D3).",
      "interiority": {
        "motive_history": "Early failures and threats to his family taught him that control protects those he loves.",
        "justification": "He frames corruption as necessary to provide security and stability."
      }
    }
  ],
  "character_count": 2,
  "metadata": {
    "project_id": "monitored_e2e_test_novel_20250821_154550",
    "step": 3,
    "version": "1.0.0",
    "created_at": "2025-08-21T16:02:49.982116",
    "model_name": "claude-3-haiku-20240307",
    "temperature": 0.3,
    "seed": 42,
    "prompt_hash": "17d77f638360ed63ddc18df0d5c22a539c8df19a0031e2ad6526c48d4c865839",
    "validator_version": "1.0.0",
    "hash_upstream": "82065b0278796ab5779e49c20a8e67d10c3f2ebd442c97465b25188593fd7388"
  },
  "protagonist_antagonist_collision": {
    "collision_verified": true,
    "collision_point": "Direct opposition of goals"
  },
  "disaster_alignment": {
    "d1_characters": [
      "Maya",
      "Morrison"
    ],
    "d2_characters": [
      "Maya",
      "Morrison"
    ],
    "d3_characters": [
      "Maya",
      "Morrison"
    ]
  }
}